{"adapter_protocol_version":1,"all_system_ids":["GeneratedCounterSystem","GeneratedLootRollSystem"],"compiled_from_cgs_hash":"6f6174ea9e47e2851581094f53ddd2b2f5049390f8cf0eefc35bf54c66932abc","component_access_sets":{"all_reads":[300,301],"all_writes":[300],"by_system":{"GeneratedCounterSystem":{"reads":[300],"writes":[300]},"GeneratedLootRollSystem":{"reads":[301],"writes":[]}},"component_ids":[300,301],"schema":"xace.sgc.component_access_sets.v1"},"created_tick":0,"migration_status":"current","phases":{"2":{"groups":[{"execution_index":0,"group_id":"Simulation_group_0","parallel":true,"phase":"Simulation","serialization_constraints":[],"systems":["GeneratedCounterSystem","GeneratedLootRollSystem"]}],"phase":"Simulation","total_system_count":2}},"plan_hash":"865a4c1464056a7b153b93cd123ab4c2faa9cd96b2b921c750d93f48b83471b4","plan_version":1,"proof_bundle":{"compiled_from_cgs_hash":"6f6174ea9e47e2851581094f53ddd2b2f5049390f8cf0eefc35bf54c66932abc","input_hash":"a86362ba0f04ac67dc2a5ab2a6ddfc3c609efc34a50c4dabff83b69d51b78688","path":".xace/proof/sgc/6f6174ea9e47e2851581094f53ddd2b2f5049390f8cf0eefc35bf54c66932abc","plan_hash":"865a4c1464056a7b153b93cd123ab4c2faa9cd96b2b921c750d93f48b83471b4","schema":"xace.sgc.proof_ref.v1","validation_hash":"ebda7dff13b320a9098ea29eaee55b0ac84e7c85bd32cfb785d3e722859fff0b"},"schema_version":"0.1.0","system_metadata":{"schema":"xace.sgc.system_metadata.v1","systems":{"GeneratedCounterSystem":{"depends_on":[],"description":"","deterministic":true,"display_name":"Generated Counter System","phase":"Simulation","version":{"major":1,"minor":0}},"GeneratedLootRollSystem":{"depends_on":[],"description":"","deterministic":true,"display_name":"Generated Loot Roll System","phase":"Simulation","version":{"major":1,"minor":0}}}}}